{
  "type": "session.welcome",
  "timestamp": "2026-03-14T12:00:00Z",
  "session_id": "sess_01HXYZABCDEF",
  "sequence": 1,
  "version": "1.0",
  "payload": {
    "accepted": true,
    "server_time": "2026-03-14T12:00:00Z",
    "heartbeat_interval_ms": 5000,
    "message": "welcome"
  }
}
