{
  "type": "audio.chunk",
  "timestamp": "2026-03-14T12:00:01Z",
  "session_id": "sess_01HXYZABCDEF",
  "sequence": 2,
  "version": "1.0",
  "payload": {
    "stream_id": "stream_001",
    "chunk_index": 0,
    "codec": "opus",
    "sample_rate_hz": 16000,
    "frame_duration_ms": 20,
    "channel_count": 1,
    "data_base64": "T1BVU19GUkFNRV9EQVRB"
  }
}
