{
  "type": "tts.end",
  "timestamp": "2026-03-14T12:00:07Z",
  "session_id": "550e8400-e29b-41d4-a716-446655440000",
  "sequence": 3,
  "version": "1.0",
  "payload": {
    "request_id": "stream-001",
    "audio_base64": "AAABAAIAAwAEAAUA",
    "duration_ms": 1200,
    "sample_rate_hz": 16000,
    "codec": "pcm"
  }
}
